number;category;answer;question;m;ignore
15533;KUN;nolan,christopher;"regisseur van de film ""the dark knight"" uit 2008";3;
15534;KUN;nolan,christopher;"regisseur van de film ""the prestige"" uit 2006";3;
15535;KUN;noortje;"winnares (voornaam) ""op zoek naar Mary Poppins"", AVRO-show 2009/2010";2;
15536;KUN;norton,edward;"wie speelt de verteller/narrator (ook wel Jack genoemd) in film ""fight club"" uit 1999";3;
15537;KUN;norton,edward;"wie speelt the Hulk in de film ""the incredible hulk"" 2008";3;
15538;KUN;nouvel,jean;Fr. architect v. oa Torre Agbar Barcelona en Musee du quai Branly Parijs;3;
15539;KUN;novak,kim;"vr.hoofdrolspeler in ""Vertigo"" uit 1958";3;
15540;KUN;nuhr;cabaretgroep Joep v.Deudekom,Peter Heerschop,Viggo Waas;3;
15541;KUN;o.j.;wat zijn de 2 voorletters van vm. Am. footballplayer en acteur die ex-vrouw en vriend vermoordde, naar werd vrijgesproken;2;
15542;KUN;oerlemans;"regisseur vd film ""Novazembla"" 2011";2;
15543;KUN;oerol;naam jaarlijks terugkerend theaterfestival op Terschelling;3;
15544;KUN;oldenzaal;in welke plaats vinden wij Hist.mus.het Palthehuis;3;
15545;KUN;oldman,gary;"wie speelt rol van Lee Harvey Oswald in film ""JFK"" uit 1991";3;
15546;KUN;oleg popov;welke wereldberoemde Russ.clown overleed nov.2016 op 86 -j.leeftijd, incl.voornaam;3;
15547;KUN;olivier,laurence;wie speelt rol v.Maxim de winter in film 'rebecca' uit 1940;3;
15548;KUN;olivier,lawrence;"hoofdrolspeler in de film ""wuthering heights"" uit 1939";3;
15549;KUN;omar sy;"wie speelt rol v. Driss in film ""les intouchables"" 2011,incl.voornaam";2;
15550;KUN;ome loeks;wiens paard (peerd) heeft een standbeeld bij het station v. Groningen (2 woorden);2;
15551;KUN;o'neal,ryan;wie speelt rol van Barry Lyndon in gelijknamige film uit 1975;3;
15552;KUN;oosterbeek;in welke plaats vinden wij het Airbornemuseum;3;
15553;KUN;oosterpark;in welk Amsterdams park vinden wij het Nationaal monument slavernijverleden;3;
15554;KUN;oranjerie;gebouw,waarin 's-winters de uitheemse planten w.bewaard,wintertuin;3;
15555;KUN;oscar;goocheltrio Magic Unlimited bestaat uit 2 mannen + 1 vrouw.Man Renzo +..;2;
15556;KUN;oscar niemeyer;in 2012 op 104-j. leeftijd overleden Braz.architect ,oa Brasilia en mede-architect hoofdkw.VN NY,incl.voornaam;3;
15557;KUN;oskar;voornaam van Schindler in de film Schindlers list (1993);3;
15558;KUN;oss;in welke plaats vinden wij theater/schouwburg de Lievekamp;3;
15559;KUN;otterlo;in welke plaats vinden wij het Nederlands Tegelmuseum;3;
15560;KUN;oud;architect van het Bio vakantieoord bij Arnhem;3;
15561;KUN;oud;architect/ontwerper Nat.Monument Dam,samen met Raedeker;3;
15562;KUN;oud;wie is de architect van Rott.cafe de Unie (1925);3;
15563;KUN;oury,gerard;"regisseur van de film ""la grande vadrouille/samen uit,samen thuis"" uit 1966";3;
15564;KUN;out,rob;"wie had bijnaam ""mister veronica""";3;
15565;KUN;paard;welk dier is Meindert in Fabeltjeskrant;2;
15566;KUN;pacino,al;"wie speelt de rol van ""michael corleone"" in de film ""the godfather"" uit 1972";3;
15567;KUN;pacino,al;"welke acteur speelt mann.hoofdrol (Tony Montana) in ""scarface"" uit 1983";3;
15568;KUN;pacino,al;"wie speelt hoofdrol als Carlito Charlie Brigante ""Carlito's way"" uit 1993";3;
15569;KUN;pacino,al;"wie speelt hoofdrol v.top-detective vincent hanna in film ""heat"" uit 1995";3;
15570;KUN;pacino,al;"wie speelt rol van Sonny in film ""dog day afternoon"" uit 1975";3;
15571;KUN;palm;filmfestival Cannes:prijs is Gouden ..;3;
15572;KUN;palma,brian de;"regisseur van de film ""scarface"" uit 1983";3;
15573;KUN;palma,brian de;"regisseur van de film ""the untouchables"" uit 1987";3;
15574;KUN;palma,brian de ;"regisseur van de film ""carlito's way"" uit 1993";3;
15575;KUN;papillon;titel vd film uit 1973 over het leven van Henry Charriere;2;
15576;KUN;paradise now;titel film Ned.-Palestijns regisseur Abu-assad die een Golden Globe 2006 won;3;
15577;KUN;parijs;waar vinden wij het Louvre;1;
15578;KUN;parker;duo Bonnie en Clyde:achternaam van haar;3;
15579;KUN;parker;wie was de butler van Lady Penelope in Thunderbirds (yes maylaidy);2;
15580;KUN;parker,allan;"regisseur van de film ""missisippi burning"" uit 1988";3;
15581;KUN;pasolini;"regisseur ""il decamerone"" (1970)";3;
15582;KUN;passchier,dick;jaren '70 Tweekamp tussen 2 scholen met Judith Bos en ...;3;
15583;KUN;passchier.dick;wie presentator laatste defile Koninginnedag (1980);3;
15584;KUN;pats;clownsduo: wie hoort bij Poets;3;
15585;KUN;pearce,guy;"wie speelt rol van Leonard Shelby in film ""memento"" uit 2000";3;
15586;KUN;peck,gregory;"wie speelt rol van captain Keith Mallory in film ""guns of navarone"" uit 1961";3;
15587;KUN;peck,raoul;"regisseur van de film ""sometimes in april"" uit 2005";3;
15588;KUN;peckinpah,sam;"regisseur van de film ""the wild bunch"" uit 1969";3;
15589;KUN;peel,emma;"in ""de wrekers"" speelden John Steed en .. de hoofdrol";3;
15590;KUN;pei;Chin.architect v. oa glazen piramides binnenplaats Louvre,Kennedy Libr.Boston,Mus.Islam.Kunst Doha;3;
15591;KUN;pellemans;wie is de jury (JP) bij Lingo sinds Lucille Werner presentratrice werd (2005);3;
15592;KUN;pendanten;hoe worden in de kunst 2 bij elkaar horende werken, mn schilderijen, genoemd;3;
15593;KUN;penn,sean;"regisseur van de film ""into the wild"" uit 2007";3;
15594;KUN;pepijn;hoe heet de kater in Fabeltjeskrant;2;
15595;KUN;pepijn;welk cabaret richtte Paul v.Vliet in 1965 op;2;
15596;KUN;perkins,anthony;"wie speelt in film ""psycho"" (1960)"" de rol v.moteleigenaar Norman Bates";3;
15597;KUN;peters,maria;"maakster/regisseuse vd film ""sonny boy"" uit 2011";3;
15598;KUN;petersen,wolfgang;"regisseur van de film ""das Boot"" uit 1981";3;
15599;KUN;petersen,wolfgang;"regisseur van de film ""outbreak"" uit 1995";3;
15600;KUN;petra;"""dochtertje"" van Pipo de clown en Mammalou";1;
15601;KUN;peyo;onder welk pseudoniem werkte de tekenaar Pierre Culliford;3;
15602;KUN;peyo;wie is de tekenaar van de smurfen (pseudoniem);3;
15603;KUN;peyton place;1e Am.soapserie op TV (1964-1969) 514 aflevering met oa  Allisson en dr.Rossi;2;
15604;KUN;pfeiffer,michelle;"welke actrice speelt hoofdrol als Elvira in ""scarface"" uit 1983";3;
15605;KUN;pfeiffer,michelle;"welke filmactrice speelde hoofdrol in ""witches of eastwick""";3;
15606;KUN;phoenix,joaquin;"welke acteur speelt 1 vd mann.hoofdrollen (keizer Commodus) in ""gladiator"" uit 2000";3;
15607;KUN;phoenix,joaquin;"wie speelt in film ""walk the line (2005)"" de rol v.Johnny Cash";3;
15608;KUN;piaf,edith;la vie en rose is verfilming v.levensverhaal van..;2;
15609;KUN;piano,renzo;architect van het NEMO-gebouw in Amsterdam;3;
15610;KUN;piano,renzo;Centre Pompidou in Parijs ontworpen door 2 architecten: Rogers en;3;
15611;KUN;picard,jean-luc;captain in Startrek next generation;3;
15612;KUN;picasso;belangrijkste vertegenwoordiger van het kubisme;2;
15613;KUN;picasso;"schilder van ""meisje voor spiegel""";3;
15614;KUN;picasso;welke schilder kende een blauwe en een roze periode;2;
15615;KUN;picasso;"wie maakte het beeldje ""petite chouette (kleine uil) """;3;
15616;KUN;picasso;"wie schilderde ""les demoiselles d'avignon""";2;
15617;KUN;picasso;"wie uitspr.""alle kinderen zijn artiesten,het probleem is om artiest te blijven wanneer je volwassen bent""";3;
15618;KUN;pieck,anton;wie is de ontwerper van het sprookjespark v.de Efteling, geopend in 1952;3;
15619;KUN;piet,frans;tekenaar van Sjors en Sjimmie;3;
15620;KUN;pinter,harold;"van wie is ""the room"" het 1e toneelstuk";3;
15621;KUN;pinter,harold;"wie schreef toneelstuk ""the dumb waiter""";3;
15622;KUN;pitt,brad;"welke acteur speelt 1 vd mann.hoofdrollen (detective Mills) in ""seven"" uit 1995";3;
15623;KUN;pitt,brad;"welke acteur speelt 1 vd mann.hoofdrollen (mickey) in komische gangsterfilm ""snatch"" uit 2000";3;
15624;KUN;pitt,brad;"wie speelt de rol v.Tyler Durden in film ""fight club"" uit 1999";3;
15625;KUN;plien;cabartetduo: wie hoort bij Bianca;2;
15626;KUN;plons;hoe heet de kikvors in Fabeltjeskrant;2;
15627;KUN;poelifinario;cabaretprijs in categorie entertainment, 2018 gewonnen door Jochem Myjer;3;
15628;KUN;pola,alexander;"in TV-programma ""farce majeure""1966-1976 en 1983-1986 5 acteurs: fillekers,de braak,vd horst,benavente en …";2;
15629;KUN;polanski;"regisseur van de film ""the pianist"" uit 2002";3;
15630;KUN;polanski;welke filmregisseur werd 2009 in Zwits.gearresteerd wegens zedenzaak uit 1977;2;
15631;KUN;polanski,roman;"regisseur van ""Rosemary's baby"" ";3;
15632;KUN;polanski,roman;"regisseur van de film ""chinatown"" uit 1974";3;
15633;KUN;polanski,roman;van wie was de in 1969 vermoorde Sharon Tate de echtgenote;2;
15634;KUN;pollack,sydney;regisseur van de film Out of Africa 1985;2;
15635;KUN;pollak,kay;"regisseur van de film ""as it is in heaven/sa somi himmelen"" uit 2004";3;
15636;KUN;ponderosa;naam v.d.ranch v.d.fam.Cartwright;2;
15637;KUN;ponti;filmproducer (overleden 2007), dus niet de regisseur,  van de film dr.Zjivago uit 1965;2;
15638;KUN;poort,henk;wie speelde 1998 en 2008 rol v. Tevje in musical Anatevka;2;
15639;KUN;portman,natalie;wie speelt in Leon/the professional (1994) meisje Mathilda ;3;
15640;KUN;potter;wie is de stierenschilder;2;
15641;KUN;potter,harry;door welke rol is Daniel Radcliffe bekend geworden;2;
15642;KUN;power,tyrone;"wie speelt rol van v.moord beschuldigde Leonard Vole in film ""witness for the prosecution"" uit 1957";3;
15643;KUN;powned;nov.2009 2 nieuwe omroepen in publieke bestel: WNL en ..;2;
15644;KUN;prem;bekende advocaat en radio/TV-maker van Sur.-Hind.afkomst, achternaam Radhakishun,maar bekend door voornaam;2;
15645;KUN;prinsen,joost;door wie werd de rol van Erik Engerd gespeeld;2;
15646;KUN;prinsen,joost;"wie presenteert het programma ""met het mes op tafel""";2;
15647;KUN;pritzker price;belangrijkste architectuurprijs ter wereld;3;
15648;KUN;prochnow,jurgen;"wie speelt rol van  Heinrich Lehmann-Willenbusch in film ""das Boot"" uit 1981";3;
15649;KUN;puenzo,luis;"regisseur/maker van de film ""la historia official""uit 1985";3;
15650;KUN;pullman,bill;"wie speelt rol van jazzsaxofonist Fred Madison in film ""lost highway"" uit 1997";3;
15651;KUN;punk;voor welke stroming binnen jongerencultuur ontwierp Vivienne Westwood kleding;2;
15652;KUN;purper;w.cabaretgroep vorm(d)en Erik Brey,Frans Mulder,Marco Braam,Rop Verheyen;3;
15653;KUN;pussy;wie was tegenspeelster/Bondmeisje in Goldfinger;3;
15654;KUN;putter,jos de;"regisseur vd Canonfilm ""het is een schone dag geweest"" uit 1993";3;
15655;KUN;r van polzer;echte naam van drs. P , maar niet eerste maar laatste letter achternaam;2;
15656;KUN;radar;welk Avro/Tros-consumentenprogramma w.gepresenteerd (sinds 1995) door Antoinette Hertsenberg;2;
15657;KUN;rademakers,fons;"regisseur ""de aanslag"" + winnaar Haanstra-prijs 1998";3;
15658;KUN;rademakers,fons;"regisseur vd Canonfilm ""als 2 druppels water"" uit 1963";2;
15659;KUN;rademakers,fons;"welke regisseur maakte in 1958 debuut met ""dorp aan de rivier""";3;
15660;KUN;radhakishun;bekende advocaat en radio/TV-maker van Sur.-Hind.afkomst, voornaam Prem;3;
15661;KUN;radius,alexandra;Ned.ballerina,getrouwd m.Han Ebbelaar,met wie zij wer.ber.paar vormde;3;
15662;KUN;rafael;It.schilder v.madonna's, oa Madonna van de goudvink;3;
15663;KUN;rafael;wie schilderde portretten v. paus Leo X (ca. 1515), Castiglione,Altovitti en La Donna Velata;3;
15664;KUN;ravelijn;hoe wordt eilandje in vestinggracht tussen 2 bastions genoemd;3;
15665;KUN;rawhide;TV-serie,waarin Gill Favor en Rowdy Yates hoofdrol vertolkten;2;
15666;KUN;raymann;"v.wie is uitspraak ""vrouwen willen steeds meer gemeenschap ..v.goederen""";3;
15667;KUN;razzie;negatieve tegenhanger Oscar, slechtste acteur/regisseur in 2005 oa voor Bush en Rumsfeld;3;
15668;KUN;rebecca;in welke film (1940) komen voor Maxim de Winter, mw.Danvers, Manderley;2;
15669;KUN;redford;"wie speelt 1 vd hoofdrollen (Johnny Hooker) in film ""the sting"" uit 1973";3;
15670;KUN;redford,robert;"wie was de hoofdrolspeler in ""out of africa""";2;
15671;KUN;redgrave,vanessa;"wie speelt rol v.Julia in film ""Julia"" v.Fred Zinnemann uit 1977";3;
15672;KUN;reed,carol;"regisseur van de film ""the third man"" uit 1949";3;
15673;KUN;reed,donna;"wie speelt rol van Mary Hatch in film ""it's a wonderful life"" uit 1946";3;
15674;KUN;reeves,keanu;"wie speelt in film ""the matrix"" (1999) de rol v. Thomas Anderson/Neo";3;
15675;KUN;reid;vanaf 2016 opvolger van mr.Frank Visser, de rijdende rechter, bij KRO-NCRV ;3;
15676;KUN;reiner,rob;"regisseur/maker van de film ""this is spinal tap""uit 1982";3;
15677;KUN;reitz,edgar;"regisseur vd film-trilogie ""Heimat"", waarvan laatste deel Heimat 3 in 2004 uitkwam";3;
15678;KUN;rembrandt;"wie schilderde ""anatomische les v.dr.nicolaes tulp""";2;
15679;KUN;rembrandt;"wie schilderde ""het Joodse bruidje""";2;
15680;KUN;rembrandt;"wie werd eeuwenlang als schilder v. ""de man met de gouden helm"" beschouwd";2;
15681;KUN;reno,jean;wie speelt in Leon/the professional (1994) de huurmoordenaar Leon/the cleaner;3;
15682;KUN;renoir;"schilder van ""bal a la moulin de galette""";3;
15683;KUN;renzo;goocheltrio Magic Unlimited bestaat uit 2 mannen + 1 vrouw.Man Oscar +..;2;
15684;KUN;renzo;voornaam vd It. architect en ontwerper Piano, oa NEMO;2;
15685;KUN;repin;schilder van de Russische ziel, oa de Wolgaslepers,19e eeuw;3;
15686;KUN;replica;door ontwerper zelf gemaakte kopie van kunstwerk;3;
15687;KUN;reynolds,burt;"wie speelt rol van Lewis in film ""deliverance"" uit 1972";3;
15688;KUN;richter,sylvia;welke rol speelde Monique vd Ven in TV-politieserie Spangen (1999-2006);3;
15689;KUN;riefenstahl,leni;Du.filmmaakster (overl.2003) die nazipropagandafilms maakte;2;
15690;KUN;riefenstahl,leni;maakster v.d. film Triumph des Willens 1934;3;
15691;KUN;rienstra,yora;"wie won Wim Sonneveldprijs 2009 met ""aan jou heeft het niet gelegen""";3;
15692;KUN;rietveld;naar welk beeldend kunstenaar is de Academie Beeldende Kunsten in A'dam genoemd;3;
15693;KUN;rietveld;"ontwerper vd roodblauwe stoel begin 1900 als schoolvoorbeeld van ""de Stijl""";3;
15694;KUN;rigg,diana;"tegenspeelster v.John Steed in ""de wrekers""";2;
15695;KUN;rigg,diana;w.(Eng.) actr.sp.Bondm.Comtessa Ter.di Vicenzo in on her maj.secr.serv.;3;
15696;KUN;rijn,van;achternaam van Rembrandt;1;
15697;KUN;riley,sam;"wie speelt rol van Joy-divisionzanger Ian Curtis in film ""control"" v. Anton Corbijn uit 2007";3;
15698;KUN;ritchie,guy;"regisseur van de film ""lock,stock and 2 smoking barrels"" uit 1998";3;
15699;KUN;ritchie,guy;"regisseur van de film ""snatch"" uit 2000";3;
15700;KUN;ritmeester,frits;off.oorspr.achternaam van Frits Spits;3;
15701;KUN;ritter,thelma;"wie speelt rol van Jeff Jeffries-verpleegster Stella in film ""rear window"" van Hitchcock uit 1954";3;
15702;KUN;roadrunner;wie maakt geluid miep-miep (Eng. beep-beep) als hij op volle snelheid voorbijraast;3;
15703;KUN;robbins,tim;"wie speelt 1 vd mann.hoofdrollen (Andy) in ""the shawshank redemption"" uit 1994 naast Morgan Freeman";3;
15704;KUN;roberts,tanya;welke (Am.) actr.sp.Bondmeisje Stacey Sutton in a view to a kill;3;
15705;KUN;rocky balboa;naam vd bokser die Sylvester Stallone speelde in de gelijknamige film uit 2006;2;
15706;KUN;rococo;welke kunststijl volgde op de Barok (18e eeuw);3;
15707;KUN;rodenberry;geestelijk vader van Startrek;3;
15708;KUN;rodin;"beeldhouwer van ""burgers van calais""";2;
15709;KUN;rodin;"welke Fr. beeldhouwer maakte ""de kus"" ";3;
15710;KUN;rodriguez,amalia;in 1999 overleden Port.zangeres, bekend van de Fado;3;
15711;KUN;rogers,richard;Centre Pompidou in Parijs ontworpen door 2 architecten: Piano en;3;
15712;KUN;rohe,vd ;Duits-Am.architect (1886-1969) oa wolkenkrabber Seagram Building, Barcelona-paviljoen;3;
15713;KUN;romer,thijs;met wie is Katja Schuurman getrouwd;2;
15714;KUN;romero;"regisseur vd Am.horrorfilm ""night of the living dead"" (1968)";3;
15715;KUN;rooie rinus;wie hoort bij Pé Daalemmer;3;
15716;KUN;rooij,bob de;"welk typetje van Paul de Leeuw zegt ""hallo boppers""";2;
15717;KUN;rooy,karel de;wie speelt Mini bij artiestenduo Mini & Maxi;3;
15718;KUN;rosalien;parodie op Klazien uut Zalk door v.Kooten & de Bie: wie kwam uut Drost;3;
15719;KUN;rosemond,v.;jeugdserie in jaren '70 Floris. Wat was de achternaam van Floris;3;
15720;KUN;rosenberg,stuart;"regisseur van de film ""cool hand luke"" uit 1967";3;
15721;KUN;roshan;"Indiase Bollywood-acteur met 2 duimen,film ""kaho na pyaar hai"" en ""krrrish""";3;
15722;KUN;ross,dianan;wie sp.vrouwelijke hoofdrol in filmversie (1978) v.oorspr.musical The Wiz;3;
15723;KUN;ross,katherine;"wie speelt rol van Elaine Robinson in film ""the graduate"" uit 1967";3;
15724;KUN;rosselini,isabella;"wie speelt nachtclubzangeres Dorothy Valens in ""blue velvet"" uit 1986";3;
15725;KUN;rossi;psychiater in tv-serie Gooise Vrouwen, ook dr.in Peyton Place;2;
15726;KUN;rotstein;achternaam (v.echtgenote) van Klazien uut Zalk;3;
15727;KUN;rotterdam;"waar is het museum ""Boymans-v.Beuningen""";2;
15728;KUN;rotterdam;waar vinden wij 2 standbeelden van Ketelbinkie (uit 1994 en 1998);1;
15729;KUN;rotterdam;waar:nighttown,lantaren/venster,de doelen;2;
15730;KUN;rotterdam;"welke stad bedoelde Speenhoff in zijn lied ""montmartre aan de maas""";1;
15731;KUN;rubens;bekende Vlaamse barokschilder,oa de Liefdestuin en de 3 Gratien;3;
15732;KUN;ruijs,mien;wie is de architecte van de modeltuinen in Dedemsvaart;3;
15733;KUN;ruijssenaar,hans;architect/ontwerper Lido/Magna Plaza A'dam;3;
15734;KUN;rutger;wie is de bekendste verslaggever van Geen Stijl/PowNed (voornaam);2;
15735;KUN;ruysdaal;wie schilderde rond 1650 molen van wijk bij duurstede;3;
15736;KUN;ryan,cornelius;"op wiens gelijknamige boek is film ""the longest day""gebaseerd,ook schrijver v.""a bridge too far""";3;
15737;KUN;ryan,meg;"vr.hoofdrolspeelster (rol Annie Reed) in ""sleepless in Seattle"" (1993)";3;
15738;KUN;saint;bijnaam van Simon Templar;2;
15739;KUN;saint,eva marie;"wie speelt rol van Eve Kendall in film ""north by northwest"" uit 1959";3;
15740;KUN;salem,pamela;Indiase actrice,die in never say never again rol v.Moneypenny speelde ;3;
15741;KUN;salvador;voornaam vd Sp. kunstschilder Dali (1904-1989);2;
15742;KUN;salvador dali;mei 2009 gestolen schilderij uit Scheringa-mus.Adolescence. Van welke schilder (incl.voornaam);3;
15743;KUN;sandifort;cabaretduo Alex en Martine:Alex Klaassen en Martine ..;3;
15744;KUN;sandifort,martine;wie speelt in School-TV rol v.dokter Corrie met vragen op liefdesgebied;3;
15745;KUN;sant,gus v.;"regisseur van de film ""good will hunting"" uit 1997";3;
15746;KUN;saunders;"winnaar van ""the voice of Holland"" 2011";2;
15747;KUN;savalas,telly;"wie speelde rol Blofeld in Bond-film ""on her majesty's secret service""";3;
15748;KUN;sbs;"welke omroep zond 2007 ""sterren dansen op het ijs"" uit";2;
15749;KUN;scala;operagebouw van Milaan;2;
15750;KUN;scapino;oudste balletgezelschap van Nederland;2;
15751;KUN;schagen,riek;wie speelde huishoudster Saartje in TV-serie Swiebertje;3;
15752;KUN;scharoun,hans;Du.ontwerper/architect (1893-1972) v.concertgebouw in Berlijn,Philharmonie;3;
15753;KUN;schellinkje;hoogste en goedkoopste rang in schouwburg, engelenbak of ..;2;
15754;KUN;scherjon,elsje;wie speelde Jaakje, de vrouw van Sil in TV-serie Sil de strandjutter uit 1976;3;
15755;KUN;scheur,jaap vd;op welke vakbondsman was de figuur Aad vd Naad in Keek op de week gebaseerd;3;
15756;KUN;schiffer,claudia;Du.fotomodel/actrice die samen met Naomi Campbell in NY Fashion Cafe-rest.bezit;3;
15757;KUN;schiffmacher,henk;bekendste tatoeeerder van Nederland,oa bij Herman Brood en Anouk;2;
15758;KUN;schildpad;welk dier is Stoffel in Fabeltjeskrant;1;
15759;KUN;schilperoort,kees;"jaren 50 op radio ""Boertjes v.buut'n"".Wie speelde Gaitjan Kruutmoes";3;
15760;KUN;schilperoort,kees;"wie was presentator ""raden maar"" (geluid raden) jaren 60/70 op radio";3;
15761;KUN;schin-op-geul;"uit welke plaats kwam Frater Venantius ""ik ben Frater Venantius uit""";2;
15762;KUN;schippers,wim t.;van wie is de stem van Ernie in Sesamstraat;3;
15763;KUN;schippers,wim t.;van wie was idee om  vloer in te smeren met pindakaas als kunstwerk in museum (Loenersloot) ;3;
15764;KUN;schippers,wim t.;wie was de regisseur/bedenker vd Fred Hacheshow,jaren 70;2;
15765;KUN;schlesinger;"regisseur van de film ""midnight cowboy"" uit 1969";3;
15766;KUN;schmidt,annie mg;"van wie is de tekst van ""Margootje"" van Wim Sonneveld";2;
15767;KUN;schneider,maria;"hoofdrolspeelster in de film ""last tango in Paris"" 1972";3;
15768;KUN;scholte,rob;Ned.kunstschilder,thans Tenerife,verloor bij bomaanslag 1994 benen;3;
15769;KUN;scholten v.asschat;"wie speelt in film ""de Heineken-ontvoering""(2011) de rol v.Holleeder (REM in de film)";3;
15770;KUN;schoolstrijd;welk programma presenteren Minoesch Jorissen/Gregor Bak;3;
15771;KUN;schotland;in welk land is Sean Connery geboren/uit welk land afkomstig;3;
15772;KUN;schrama,cees;"presentator wekelijks jazzprogramma ""sesjun""";3;
15773;KUN;schreeuw,de;naam vh herdenkingsbeeld voor Theo v. Gogh (maker Henneman);2;
15774;KUN;schrijver;dagelijks TV-programma 2007 Max en Loretta. Achernaam van Loretta;2;
15775;KUN;schuurman,katja;met wie is Thijs Romer getrouwd;2;
15776;KUN;schuurman,katja;welke GTST-ster werd in 1996 video-jockey bij MTV;3;
15777;KUN;schwarzenegger,arnold;wie speelt the terminator in gelijknamige film uit 1984;1;
15778;KUN;scola,ettore;"regisseur van de film ""una giornata particole"" uit 1977";2;
15779;KUN;scolupco,izabella;welke (Poolse) actr.sp.Bondm.Natalya Simonova in golden eye;3;
15780;KUN;scooby doo;in welke TV-animatieserie speelden Fred Jones,Daphne Blake,Shaggy Rogers;3;
15781;KUN;scorsese;"regisseur van de documentaire ""no direction home:bob dylan"" uit 2005";3;
15782;KUN;scorsese;"regisseur van de film ""casino"" uit 1995";3;
15783;KUN;scorsese;"regisseur van de film ""goodfellas"" uit 1990";3;
15784;KUN;scorsese;"regisseur van de film ""raging bull"" uit 1980";3;
15785;KUN;scorsese;"regisseur van de film ""taxi driver"" uit 1976";3;
15786;KUN;scorsese,martin;"welke regisseur kreeg eindelijk feb.2007 Oscar voor film ""the departed""(2006)";2;
15787;KUN;scott,ridley;"regisseur van de film ""alien"" uit 1979";3;
15788;KUN;scott,ridley;"regisseur van de film ""american gangster"" uit 2007";3;
15789;KUN;scott,ridley;"regisseur van de film ""gladiator"" uit 2000";3;
15790;KUN;scott,tony;"regisseur van de film ""man of fire"" uit 2004";3;
15791;KUN;scott,tony;"regisseur van de film ""true romance"" uit 1993";3;
15792;KUN;scully;in de x-files wordt de hoofdrol gespeeld door Mulder en ...;2;
15793;KUN;second life;waar kun je met Linden dollars betalen;2;
15794;KUN;sellers,peter;"wie speelde het typetje ""Inspector Clouseau""";3;
15795;KUN;sellers,peter;"wie speelt in film ""dr.Strangelove"" (1964)"" de rol v.dr.Strangelove";3;
15796;KUN;servet,barend;wie was de assistent van Fred Hache (show jaren 70),gesp.d.IJf Blokker;2;
15797;KUN;sesjun;jazzprogramma dat Cees Schrama sinds 1973 presenteert;3;
15798;KUN;seven samurai;"film ""the magnificent seven"" is remake v.oorspr.Jap.film (1954) met welke titel (Am.titel,getal)";3;
15799;KUN;seydoux,lea;"wie speelt rol v.Madeleine Swann in James Bond-film ""Spectre""";3;
15800;KUN;seymour,jane;welke (Eng.) actrice speelde Bondmeisje Solitaire in live and let die;2;
15801;KUN;shaffner,franklin;"regisseur van de film ""papillon"" uit 1973";3;
15802;KUN;sharif,omar;Eg.filmacteur, tevens befaamd bridger;3;
15803;KUN;shatner,william;wie speelde de rol van captain Kirk in Startrek;2;
15804;KUN;shaw,robert;"wie speelt 1 vd hoofdrollen (Doyle Lonnegan) in film ""the sting"" uit 1973";3;
15805;KUN;sheen,charlie;"wie speelt de rol v.Chris Taylor in film ""platoon"" uit 1986";3;
15806;KUN;sheen,martin;"wie speelt rol van kapitein Benjamin Willard in film ""apocalypse now"" uit 1979";3;
15807;KUN;sheridan,jim;"regisseur van de film ""in the name of the father"" uit 1993";3;
15808;KUN;shirley temple;Am. kindsterretje dat tussen 1932 en 1949 in 50 films speelde, oa Stand up and cheer en bright eyes,  incl. voornaam;2;
15809;KUN;shoah;9 u.durende film van Claude Lanzmann over de Jodenvervolging;3;
15810;KUN;showroom;oorspr.NCRV-progr.:voorbeeld voor de Stoel en Paradijsvogels;2;
15811;KUN;sibbel,hans;wat is de off.naam van Lebbis,bek.v.Lebbis en Jansen;2;
15812;KUN;siegel,don;"regisseur van de film ""escape from alcatraz"" uit 1979";3;
15813;KUN;sierra leone;"in welk land speelt de film ""blood diamond"" uit 2006";3;
15814;KUN;sieto;wie hoort bij Marijke Hoving;2;
15815;KUN;signoret,simone;1e Francaise, die 1960 Am. Oscar won, getrouwd geweest met Yves Montand;3;
15816;KUN;signoret,simone;"wie speelt hoofdrol als Nicole Horner in film ""diabolique"" uit 1955";3;
15817;KUN;silence of the lambs;in welke film speelt Hannibal Lecter een hoofdrol;2;
15818;KUN;simek,martin;"wie gaat schuil achter de cartoonist ""anone""";2;
15819;KUN;simek,martin;wie won 2009 zilveren reismicrofoon (oorspr.Tsj.,tenniscoach,cartoonist,radio,TV);3;
15820;KUN;simic,tatjana;wie speelt rol van dochter Kees/dom blondje in Flodderfilms;2;
15821;KUN;simplistisch;welk verbond werd opgericht door Koot en Bie;2;
15822;KUN;simpson;achternaam van Homer;2;
15823;KUN;simpson;vm. Am. footballplayer en acteur die ex-vrouw en vriend vermoordde, naar werd vrijgesproken, bijnaam the Juice;2;
15824;KUN;sindala;Indische vriend van Floris,tv-jeugdserie uit 1969 met Rutger Hauer als Floris;3;
15825;KUN;singer,brian;"regisseur van de film ""the usual suspects"" uit 1995";3;
15826;KUN;sint-petersburg;waar vinden wij de Hermitage;2;
15827;KUN;sioux;"over welke indianenstam gaat de film ""dances with wolves"" uit 1990";2;
15828;KUN;sissing;"presentator ""op zoek naar Evita"", 8 TV-avonden 2007";2;
15829;KUN;sjakie;wie (naam in de films) is de welzijnswerker in de Flodderfilms ;2;
15830;KUN;sjostrom,victor;"hoofdrolspeler (Isak Borg) in ""wilde aardbeien"" van Ingmar Bergman uit 1957";3;
15831;KUN;skywalker;achternaam vd hoofdfiguren uit de films Star Wars vader Anakin en zoon Luke;3;
15832;KUN;slagter,jan;oprichter/directeur omroep Max;3;
