number;category;answer;question;m;ignore
17859;POL;harbers,mark;juni 2019 werd Ankie Broekers-Knol staatssecr. v. Justitie en Veilgheid als opvolger van …..;3;
17860;POL;harper,stephen;2006-2015 premier (minister-president) van Canada;3;
17861;POL;havermans;voorganger Deetman als burgemeester den Haag;3;
17862;POL;hawai;"welke Am.staat heeft bijnaam ""Aloha state""";3;
17863;POL;hedwigepolder;welke Zeeuwse polder zal wel/niet onder water w.gezet ter comp.uitdiepen Westerschelde;2;
17864;POL;heemskerk;staatssecretaris Econ.Zak.,mn Buitenl.Handel in kabinet Balkenende-4;3;
17865;POL;heerma;voorganger van Jaap de Hoop Scheffer als fractieleider CDA;3;
17866;POL;heerma,enneus;"over welke CDA-politicus zei v.Agt ""het ontbreekt hem aan een vechtersmentaliteit""";3;
17867;POL;heerts;sinds 2012 voorzitter FNV;3;
17868;POL;hees,v.marijke;voorzitster PVDA die in 2000 na strubbelingen aftrad;3;
17869;POL;heidema;CvdK van Overijssel sinds 2018;3;
17870;POL;heinsbroek;namens LPF minister van Economische Zaken in Balkenende-1 ;2;
17871;POL;heinz;Dem.pres.kand.VS,Kerry,getrouwd met vrouw uit welke fam.;2;
17872;POL;hendrik;vader van prinses Juliana;2;
17873;POL;henk;fictief Ned.echtpaar dat Wilders gebruikt als doorsnee Ned.echtp.,waarvoor hij opkomt.Man=;2;
17874;POL;hennis;minister v.Defensie in kabinet Rutte-2, afgetreden okt.2017;2;
17875;POL;herben;voorganger v.As als fractievoorzitter LPF;1;
17876;POL;herbert;vader van GW Bush heeft tussen George en Walker nog 1 voornaam;3;
17877;POL;hermans,loek;minister v.Onderwijs in kabinet Kok-2,voorzitter MKB-Nederland van 2003-2011;2;
17878;POL;hermans,loek;voorz. VVD-fractie 1e Kamer die 2015 aftrad na vernietig.rapport over zijn rol als bestuurder thuiszorgorg.Meavita;2;
17879;POL;herrema;Amsterdamse wethouder die in 2009 aftrad na overschrijding kosten Noord-Zuidlijn;2;
17880;POL;hillen;minister v.Defensie in kabinet Rutte-1;2;
17881;POL;hillen,hans;"van welke politicus is uitspraak ""er zijn veel pitspoezen in Den Haag""";3;
17882;POL;hilterman;achternaam mr.G.B.J.;2;
17883;POL;hirsch ballin;opvolger Donner als minister Justitie,toen die aftrad nav  Schipholbrand;2;
17884;POL;hoekstra;kabinet Rutte-3: minister van Financien;1;
17885;POL;hoeven,maria vd;minister v. Economische Zaken in kabinet Balkenende-4 en v.Onderwijs in Balkenende-2;2;
17886;POL;hoeven,maria vd;w.minister droeg tot verontwaardiging PvdD bont op trappen Huis Ten Bosch;2;
17887;POL;hoeven,vd;"over welke Maria ""waarom doe je zo Maria""";3;
17888;POL;hoge raad;hoogste rechtscollege in Ned.;1;
17889;POL;hollande;van wie was Trierweiler partner, begin 2014 uit elkaar;2;
17890;POL;hollande;voorganger Macron als president Frankrijk;2;
17891;POL;hongkong;waarvan was Chris Patten de laatste gouverneur;3;
17892;POL;honolulu;geboorteplaats van Barack Obama;3;
17893;POL;hoof,v.;opvolger Rutte als staatsecr. Sociale Zaken Balkenende-2;3;
17894;POL;hoogervorst;minister Volksgezondheid in kabinet Balkenende-2;1;
17895;POL;hoop scheffer,de jaap;voorganger Bot als Min.Buit.Zak.;2;
17896;POL;hoover;wie was van 1924-1972 de leider van de FBI;3;
17897;POL;horst,guusje ter;minister v. Binnenlandse Zaken in kabinet Balkenende-4;2;
17898;POL;houten,samuel v.;initiatiefnemer tot het Kinderwetje (1874),afschaffing kinderarbeid;3;
17899;POL;howard;voorganger v.Kevin Rudd als premier v.Australie;3;
17900;POL;hugo borst;sportjournalist met demente moeder die boegbeeld werd v. betere zorg in verpleeghuizen, incl. voornaam;2;
17901;POL;hugo de jonge;kabinet Rutte-3: minister van VWS (incl. voornaam);2;
17902;POL;huizinga,tineke;enige staatssecretaris van de Christen Unie in kabinet Balkemende-4;2;
17903;POL;huizinga,tineke;vrouwelijke staatssecr.Verkeer &Waterst.in kab.Balkenende-4,CU,OV-chipkaart,lijkt op Juliette Binoche;3;
17904;POL;hussein;2e voornaam van Barack Obama;3;
17905;POL;hutton;lord,wiens rapport Blair vrijpleitte  van leugens mbt massavernietigingswapens Irak;2;
17906;POL;hutu's;welke Afr.stam was de tegenstander van de Tutsi's;1;
17907;POL;iaea;waarvan is Japanner Yukija Amano sinds 2010 directeur-generaal/hoofd (afkorting);3;
17908;POL;idaho;"welke Am.staat heeft bijnaam ""Gem state""";3;
17909;POL;ijsland;van welk land wordt het parlement Althing genoemd;3;
17910;POL;ijsselmuiden;afgetreden burgemeester Volendam nav oudejaarsbrand 2000;3;
17911;POL;iliescu;opvolger van Ceausescu als president van Roemenie, ook pres.van 2000-2004;2;
17912;POL;illinois;"welke Am.staat heeft bijnaam ""Prairie state""";3;
17913;POL;india;Nobelprijs Vrede 2014: uit welk land is winnaar Satiharti afkomstig;1;
17914;POL;india;v.welk land werd Pratibha Patil de eerste vrouwelijke president (dus niet premier) ;2;
17915;POL;indiana;"welke Am.staat heeft bijnaam ""Hoosier state""";3;
17916;POL;indira gandhi;wie was van 1966-1977 en van 1980-1984 minister-pres.v.India,incl.voornaam;2;
17917;POL;ines;dochter Ariane v.Willem-Alexander en Maxima heeft 4 voornamen.Wat is 4e;3;
17918;POL;italie;uit welk land komt de huidige voorzitter vh Eur. Parlement;2;
17919;POL;italie;v.welk land was Letta (Enrico) van 2013-2014 de regeringsleider/premier;2;
17920;POL;ivo opstelten;"welke politicus had de bijnaam ""de pruttelaar"", incl.voornaam";3;
17921;POL;j;2e naam (voorletter) van Bill Clinton;2;
17922;POL;jager,de;minister v.Financien in kabinet Rutte-1;1;
17923;POL;janmaat;wie zat van 1982-1984 in de 2e Kamer voor de extreem-rechtse Centrumpartij, later CentrumDemocraten;3;
17924;POL;jansen;commissaris koningin overijssel 2003-2010;3;
17925;POL;jemen;Nobelprijs voor de vrede 2011 naar 3 vrouwen: uit Liberia 2 vrouwen,3e vrouw uit..;2;
17926;POL;jenna;tweeling van president Bush: Barbara en ..;2;
17927;POL;jet bussemaker;minister v.Onderwijs in kabinet Rutte-2,incl.voornaam;2;
17928;POL;jetten,rob;opvolger Pechtold als fractievoorzitter D66 in 2e Kamer;1;
17929;POL;joetsjenko;winnaar 2e ronde presidentsverkiezingen Oekraine 2004;2;
17930;POL;johnson;opvolger May als premier v. GB;1;
17931;POL;johnson,boris;in 2008 gekozen burgemeester v.Londen;3;
17932;POL;joko widodo;president van Indonesie 2014-heden (incl. voornaam);3;
17933;POL;jolande sap;opvolger Femke Halsema als fractieleider Groen Links in 2e Kamer (2010) incl.voornaam;2;
17934;POL;jong,winnie de;"wie voerde in verkiezingen 2003 de lijst ""conservatieven.nl"" aan";3;
17935;POL;jonge,de;kabinet Rutte-3: minister van VWS;2;
17936;POL;jonge,hugo de ;mininster VWS en vice-ministerpresident kabinet Rutte-3;2;
17937;POL;jongeling,piet;welk 2e kamerlid (1963-1977) ging schuil achter Piet Prins,oa Snuf de hond;3;
17938;POL;jordanie;van welk land is Abdullah-2 thans de koning;2;
17939;POL;jorritsma;opvolger Loek Hermans als fractievoorzitter VVD in 1e Kamer 2015;1;
17940;POL;jorritsma,john;van 2008 tot 2016 CvdK v.Friesland, sinds 2016 burgmeester v.Eindhoven;3;
17941;POL;jozias;voornaam van v.Aartsen, minister, fractievoorzitter VVD, burgemeester den Haag;2;
17942;POL;juncker;wie was van 1995-2013 premier van Luxemburg en daarna (2014-2019) voorzitter Eur. Commissie;2;
17943;POL;kabouterpartij;partij v.Roel v.Duin die in 1970 5 zetels haalde in gem.A'dam;2;
17944;POL;kaczynski;tweelingbroers,machthebbers Polen die okt.2007 verkiezingen verloren;2;
17945;POL;kadima;Isr.politieke partij,opgericht 2005 door Sharon,winnaar verk.2006;3;
17946;POL;kajsa ollongren;kabinet Rutte-3: minister van Binnenlandse Zaken (incl. voornaam);2;
17947;POL;kalsbeek;opvolger Cohen als staatssecretaris in Kok-2;2;
17948;POL;kalverboer;sinds 2016 kinderombudsman-/vrouw;3;
17949;POL;kamminga;voorganger Cornielje als commissaris vd koningin in Gelderland;2;
17950;POL;kamp;minister v.Economische Zaken in kabinet Rutte-2;2;
17951;POL;kamp;minister v.Sociale Zaken in kabinet Rutte-1;3;
17952;POL;kamp;"welke politicus heeft de bijnaam ""de sluipmoordenaar""";3;
17953;POL;kansas;uit welke Am.staat komt moeder Barack Obama;2;
17954;POL;kansas;"welke Am.staat heeft bijnaam ""Sunflower state""";3;
17955;POL;kapital,das;hoofdwerk van Karl Marx;2;
17956;POL;karadzic;politiek leider Serviers in de Joegoslavische strijd;2;
17957;POL;kasparov;Russ.schaakgrootmeester die presidentskandidaat Rusland was voor oppositie;2;
17958;POL;katsev;Isr.president die terugtrad begin 2007 nav beschuldig.sexuele intim.e.d.;3;
17959;POL;kazachstan;van welk land is Nazarbajev president/staatshoofd;3;
17960;POL;keeler,christine;prostituee, die affaire had m. Eng.minister Perfumo die daarna moest aftreden;3;
17961;POL;keijzer;kabinet Rutte-3: staatssecretaris van Economische Zaken;3;
17962;POL;keizer,henri;(oveeleden) beoogd VVD-voorzitter die moest opstappen vanwege dubieuze transactie met uitvaartverzekeringmij;3;
17963;POL;kelly,david;Br.wapendeskundige-/inspecteur die juli 2003 zelfmoord pleegde;3;
17964;POL;kenia;uit welk land is vader Barack Obama afkomstig;2;
17965;POL;kennedy;"v.welke Am.""de Amerikanen zijn zo slap dat zij geen 50 mijl binnen 20 uur kunnen wandelen""";2;
17966;POL;kennedy;"welke Am. president had bijnaam ""king of camelot""";3;
17967;POL;kennedy,ted;"welke Am.senator (overleden 2009) had bijnaam ""de leeuw van de Senaat""";2;
17968;POL;kentucky;"welke Am.staat heeft bijnaam ""Bluegrass state""";3;
17969;POL;kerry;dem.pres.kand.VS bij verkiezingen 2004 en minister Buit.Zaken van 2013-2017;1;
17970;POL;kerry;minister Buit.Zaken VS 2013;2;
17971;POL;kgb;geheime dienst van de vroegere SU;1;
17972;POL;kim-young-un;leider van Noord-Korea;1;
17973;POL;kirchner;sinds 2007 president/staatshoofd van Argentinie,vanaf 2010 zijn vrouw;2;
17974;POL;kissinger;welke Am.min.Buit.Zak. werd bekend door pendeldiplomatie;2;
17975;POL;klijnsma;CvdK Drenthe, benoemd sep.2017;1;
17976;POL;klink;minister v. VWS (Volksgezondheid) in kabinet Balkenende-4;3;
17977;POL;klompe;minister die 1969 dubbele zoen kreeg van Reve na uitreiking PC-Hooftprijs;3;
17978;POL;klompe;"welke politica had bijnaam ""de spionne van Romme""";3;
17979;POL;knaap,vd;staatssecretaris v. Defensie in Balkenende-2,3,4,thans burgemeester Ede;3;
17980;POL;knops;kabinet Rutte-3: staatssecretaris van Koninkrijksrelaties;3;
17981;POL;koenders;minister v. Ontwikkelingssamenwerking in kabinet Balkenende-4;2;
17982;POL;koenders;opvolger v.Timmermans als minister Buit.Zaken in kabinet Rutte-2;1;
17983;POL;kohl;van 1992-1998 bondskanselier v.Duitsland, omvangrijke CDU-politicus;2;
17984;POL;kohl;"welke Du. politicus (ex-bondskanselier) had bijnaam ""Birne"" en ""der Dicke""";2;
17985;POL;kohler;opvolger Rau als president Duitsland;2;
17986;POL;kok,wim;"wie wordt bedoeld met ""de timmermanszoon uit Bergambacht""";2;
17987;POL;komorowski;sinds 2010 president (staatshoofd)  v.Polen;3;
17988;POL;koninkrijkszaken;wat komt officieel achter Min.Binn.Zaken (en ...);2;
17989;POL;koole;voorganger Ploumen als voorzitter PVDA;2;
17990;POL;koop tjuchem;bedrijf,waarvan klokkenluider bos schaduwboekhouding openbaarde;2;
17991;POL;kopacz,eva;opvolger Tusk als regeringsleider/minister-president Polen;3;
17992;POL;kopvoddentaks;hoe noemde Wilders denigrerend belasting op boerka;2;
17993;POL;korthals;minister Just. Kok-2 die aftrad nav rapport enquetecomm.bouwfraude;2;
17994;POL;kosovo;waarvan was begin 2006 overleden Rugova president;2;
17995;POL;kostunica;opvolger van Milosevic als leider van Joegoslavie;3;
17996;POL;kreisky,bruno;wie was in de jaren 70 bondskanselier van Oostenrijk;2;
17997;POL;kroatie;laatst toegetreden land tot EU (2013);2;
17998;POL;kroatie;van welk land was Tudjman tot zijn dood president;2;
17999;POL;kroes,neelie;"wie:ik kan me voorstellen dat anderen zeggen ""met 70 wil ik rozen gaan kweken"", maar dat is niet mijn hobby";3;
18000;POL;krol,henk;fractievoorzitter 50-plus in 2e Kamer;2;
18001;POL;krom,de;staatssecretaris v.Sociale Zaken in kabinet Rutte-1;3;
18002;POL;kroonkolonie;staatsvorm van Hongkong in Britse tijd;2;
18003;POL;kuiper;voorganger Welten als politiechef Amsterdam;2;
18004;POL;kuyper,abraham;"welke politicus had bijnaam ""klokkenist der kleine luyden"" ";3;
18005;POL;kuzu;pol.leider vd pol.beweging DENK;3;
18006;POL;laan,eberhard vd;opvolger Ella Vogelaar als minister v.Wonen,Wijken en Integratie;2;
18007;POL;laan,medy vd;staatssecr.Onderwijs in Balkenende-2,die bleef na aftreden Nijs;3;
18008;POL;lafontaine;Du.SPD-politicus, in 1990 door gestoorde vrouw in hals gestoken;3;
18009;POL;lammers,han;wie: achtereenvolgens wethouder A'dam, landdrost RIJP, burgem.Almere,CvdK Flevoland, interimburgemeester Groningen (overleden 2000);3;
18010;POL;landbouw;op welk ministerie was Sicco Mansholt 6 x minister;2;
18011;POL;lavrov;Russ. minister Buitenlandse Zaken;2;
18012;POL;lazrak,ali;welke dissident werd jan.2004 uit de SP gegooid;3;
18013;POL;lech;in welke Oost.plaats gaat koninklijke familie jaarlijks op wintersportvakantie;2;
18014;POL;lech kaczynski;Pools president die 2010 bij vliegtuigongeluk in Rusland omkwam, incl.voornaam;2;
18015;POL;leefbaar nederland;van welke partij is Haitske vd Linde lijsttrekker geweest;2;
18016;POL;leemhuis;comm.kon.ZH die 1999 aftrad ivm Ceteco-affaire (mansnaam, voornaam Joan, meisjesnaam Stout);2;
18017;POL;leers;burgemeester Maastricht,die begin 2010 moest opstappen w.belangenverstrengeling;2;
18018;POL;leers;minister v.Immigratie en Asiel in kabinet Rutte-1;2;
18019;POL;leeuwarden;van welke gemeente is Ferd Crone sinds 2007 burgemeester;3;
18020;POL;leeuwen,dian v.;"welke politica (ex-VVD) had bijnaam ""de Stalin vd Koninginnegracht"" ";3;
18021;POL;leeuwen,hannie v.;"welke politica had bijnaam ""straaljager Hannie""";3;
18022;POL;leges;hoe wordt de kostenvergoeding genoemd die gemeenten rekenen;1;
18023;POL;leiden;in welke stad 2003 referendum keuze burgemeester Groen of Lenferink;2;
18024;POL;lenferink;2003: referendum Leiden mbt keuze burgemeester.Wie werd het?;3;
18025;POL;lenin;1e Russ.leider na de revolutie van 1917/1918;2;
18026;POL;letta;sinds 2013 regeringsleider v.Italie als opvolger v.Monti;3;
18027;POL;libdems;v.welke Br.pol.partij is Clegg de leider;2;
18028;POL;liberia;Nobelprijs voor de vrede 2011 naar 3 vrouwen: uit welk land kwamen 2 vrouwen;2;
18029;POL;libie;uit welk land is voorzitter VN-veiligheidsraad (Ettalhi) afkomstig;2;
18030;POL;lie,trygve;van 1946-1952 (tot nu toe enige Noorse) secretaris-generaal vd VN;3;
18031;POL;liebermann;running mate van Gore voor de Am.pres.verkiezingen 2000;3;
18032;POL;lieftinck;min. van Financien 1945-1952,bekend van het tientje;3;
18033;POL;likud;partij van Nethanayu;2;
18034;POL;lilian marijnissen;opvolger van Roemer als politiek leider/fractieleider SP incl. voornaam;2;
18035;POL;limburg;van welke provincie is Bovens CvdK sinds 2011;2;
18036;POL;limmen,maurice;voorzitter CNV sinds 1 januari 2014;3;
18037;POL;linde,haitske vd;wie werd eind 2002 gekozen tot lijsttrekker Leefbaar Nederland;3;
18038;POL;linden,vd;van 2009-2011 voorzitter 1e Kamer, uit Limburg, voornaam Rene;3;
18039;POL;linden,vd;"welke politicus had bijnaam ""us reneke"" ";3;
18040;POL;linschoten;welke politicus moest aftreden ivm CTSV-affaire;3;
18041;POL;livingstone,ken;welke Eng. politicus wordt bedoeld met red ken/rooie ken;3;
18042;POL;loco-burgemeester;met welke term wordt de waarnemend burgemeester aangeduid;2;
18043;POL;loesjkov;in 2010 door Medvedev ontslagen burgemeester v.Moskou;3;
18044;POL;loo;in welk paleis woont Margriet;2;
18045;POL;louisiana;"welke Am.staat heeft bijnaam ""Pelican state""";3;
18046;POL;lpf;voor welke partij was Nawijn 2002-2003 minister van Vreemdelingenzaken & Integratie;1;
18047;POL;lubbers;"wie noemde v. Agt ""de koene keeper""";3;
18048;POL;lubbers,ruud;wie zei bij Alg.Besch.1982 tot 3x toe mevr.Bakker t.Ina Brouwer,in CPN opv.Marcus Bakker;3;
18049;POL;lugo,fernando;in 2008 winnaar presidentverkiezingen v.Paraguay, bijnaam de Rode Bisschop;3;
18050;POL;m.i.-6;Br.tegenhanger FBI;2;
18051;POL;maaren,v.;in 2001 met vraagtekens afgetreden burgemeester Leeuwarden;3;
18052;POL;maastricht;van welke gemeente was Gerd Leers, later minister, burgemeester;2;
18053;POL;mabel;beoogd opvolger v.Tutu als voorzitter v. The Elders;2;
18054;POL;macron;Fr.president sinds 2017;1;
18055;POL;maduro;huidige (interim-) president v. Venezuela;3;
18056;POL;maine;"welke Am.staat heeft bijnaam ""Pine Tree state""";3;
18057;POL;makarios;welke aartsbisschop was van 1960 -1974 president Cyprus;2;
18058;POL;malala;vrouwelijke winnaar Nobelprijs voor de Vrede 2014, bekend onder haar voornaam;2;
18059;POL;mammoetwet;welke onderwijswet werd tijdens bewind min.Cals ingevoerd;2;
18060;POL;mans;burgemeester tijdens vuurwerkramp Enschede 2000;2;
18061;POL;mansveld,wilma;staatssecretaris v.Infrastructuur en Milieu (oa NS en Prorail) in kabinet Rutte-2, afgetreden vw. Fyra;3;
18062;POL;mao;"wie schreef ""het rode boekje""";1;
18063;POL;mao;wie werd in 1949 de 1e communistische leider van China;2;
18064;POL;marcouch;sinds 2017 burgemeester v. Arnhem;2;
18065;POL;marcouch;"wie heeft bijnaam ""de sheriff uit Slotervaart"" vw zijn aanpak v. jeugdcriminaliteit";3;
18066;POL;margaretha-2;wie is sinds 1972 koningin v.Denemarken;3;
18067;POL;margarita;oudste dochter van de 4 dochters van wijlen Bernard/Juliana;2;
18068;POL;margvelasvili;2013 gekozen opvolger v.Sakasvili als president v.Georgie;3;
18069;POL;marijke;vroegere naam (geboortenaam) van prinses Christina;1;
18070;POL;marijnissen;opvolger van Roemer als politiek leider/fractieleider SP;1;
18071;POL;marijnissen;voorganger Kant als partijleider Socialistische Partij (SP);1;
18072;POL;marijnissen;"welke politicus heeft bijnaam ""de tovenaar van Oss"" ";2;
18073;POL;marijnissen;"welke politicus wordt wel ""de grote kale leider"" genoemd";1;
18074;POL;mark harbers;kabinet Rutte-3: staatssecretaris van Justitie;3;
18075;POL;marx,karl;"wie schreef ""das Kapital""";2;
18076;POL;maryland;"welke Am.staat heeft bijnaam ""Old Line state""";3;
18077;POL;massachussets;voor welke staat was Ted Kennedy,overleden 2009,senator;3;
18078;POL;massachussets;"welke Am.staat heeft bijnaam ""Bay state""";3;
18079;POL;may;opvolger Cameron als prime-minister van Engeland/GB;1;
18080;POL;may-weggen;voorganger vd Donk als commissaris koningin noord-brabant;2;
18081;POL;mbeki;opvolger Mandela als president Zuid-Afrika;3;
18082;POL;medvedev;premier van Rusland sinds 2012 onder Poetin;2;
18083;POL;megawati;voorganger Yudhojono als president van Indonesie;2;
18084;POL;meijdam;burgemeester Zaanstad die sep.2005 aftrad ivm relatie met gem.secr.;3;
18085;POL;meis,fre;1e communist, die standbeeld kreeg (2002 in geb.pl.Oude-Pekela);2;
18086;POL;melania;voornaam echtgenote Donald Trump;2;
18087;POL;melkert;"welke politicus had de bijnaam ""rupsje nooitgenoeg""";3;
18088;POL;menno snel;kabinet Rutte-3: staatssecretaris van Financien;3;
18089;POL;merck sharp dohme;waar was Bolkestein commissaris, maar legde functie na rel neer;3;
18090;POL;mercouri,melina;Gr.actrice en politica, van 1981-1985 min.v.Cultuur;3;
18091;POL;merkel;bondskanselier Duitsland;1;
18092;POL;mertens;de 200 machthebbers in Ned. zijn de 200 van ...;3;
18093;POL;mexico;van welk land is Felipe Calderon de president;2;
18094;POL;michail;voornaam Gorbatsjov;2;
18095;POL;michel;sinds 2014 premier van Belgie;3;
18096;POL;michelle;voornaam echtgenote Obama;1;
18097;POL;michigan;"welke Am.staat heeft bijnaam ""Great Lake state""";3;
18098;POL;michigan;"welke Am.staat heeft bijnaam ""Wolverine state""";3;
18099;POL;middelkoop;minister v. Defensie in kabinet Balkenende-4;2;
18100;POL;middendorp.ton;hoogste militair in Ned., commandant der strijdkrachten 2015;3;
18101;POL;middendorp.ton;in okt.2017 trad min.v.Def. Hennis af, tezamen met Hoofd der Strijdkrachten. Wie was dat;3;
18102;POL;middleton;met wie is Br.prins William 2011 getrouwd;1;
18103;POL;mierlo,hans v.;politicus: de begroting is als een deken in de winter.Als de een m naar zich toe trekt, ligt de ander in de kou;3;
18104;POL;mierlo,hans van;mede-oprichter/1e partijleider D66;2;
18105;POL;mierlo,hans van;"welke politicus had bijnaam ""de leeuw van Glenn Eagles""";3;
18106;POL;milliband;van 2010-2015 leider Eng.Labourparty;2;
18107;POL;milosevic;ex-president Joegosl.,in 2000 weggestemd en uitgeleverd aan tribunaal;1;
18108;POL;miltenburg,v.;voorzitter 2e kamer van 2012-2015,afgetreden nav Teeven-affaire;2;
18109;POL;minnesota;"welke Am.staat heeft bijnaam ""Land of 10.000 lakes""";3;
18110;POL;minnesota;"welke Am.staat heeft bijnaam ""North Star state""";3;
18111;POL;missisippi;"welke Am.staat heeft bijnaam ""Magnolia  state""";3;
18112;POL;missouri;"welke Am.staat heeft bijnaam ""Show me state""";3;
18113;POL;mitterand;opvolger Giscard 'Estaing als president van Frankrijk;2;
18114;POL;mitterand;voorganger Chirac als president van Frankrijk;2;
18115;POL;mitterand;"welke Fr. politicus had bijnaam ""tonton"" (oompje)";3;
18116;POL;moebarak;opvolger Sadat als president van Egypte;2;
18117;POL;moebarak;president van Egypte 1981-2011, in 2012 veroordeeld tot levenslange gevangenisstraf;2;
18118;POL;mohammed-6;wie is de koning van Marokko;3;
18119;POL;mona keijzer;kabinet Rutte-3: staatssecretaris van Economische Zaken incl. voornaam;3;
18120;POL;monasch;wie richtte nov.2016 nieuwe politieke partij Nieuwe Wegen op;2;
18121;POL;mondale;welke Dem.kandidaat versloeg Reagan in 1984, 2e 4-jr.periode;3;
18122;POL;monicagate;affaire Clinton/Lewinsky n.a.v. Watergate;2;
18123;POL;montana;"welke Am.staat heeft bijnaam ""Treasure state""";3;
18124;POL;montesquieu;grondlegger van de trias politica, driemachtenleer;3;
18125;POL;morsi;in 2012 gekozen president Egypte vd Moslimbroederschap, in 2013 door leger afgezet en ter dood veroordeeld;3;
18126;POL;moskowicz;kortstondig leider van VNL (april 2015-januari 2016);1;
18127;POL;mossad;Isr.geheime dienst;2;
18128;POL;mountbatten;achternaam van prins Philip van Engeland;3;
18129;POL;musharraf;ex-generaal van 2001-2008 president van Pakistan;2;
18130;POL;muskens;welke bisschop vond stelen van een brood acceptabel;2;
18131;POL;mussolini;It. staatshoofd tijdens WO-II;2;
18132;POL;mussolini;wie wordt bedoeld met Il Duce;2;
18133;POL;nagel,jan;van 2011-2019 1e kamerlid voor 50-plus;2;
18134;POL;naina;voornaam vrouw van Boris Jeltsin;2;
18135;POL;nansenpaspoort;paspoort voor personen zonder nationaliteit,vluchtelingenpaspoort;3;
18136;POL;napolitano;off. staatshoofd/president v.Italie ;3;
18137;POL;nawijn;voorganger Verdonk als minister v. Vreemdelingenzaken & Integratie;3;
18138;POL;nazarbajev;president/staatshoofd van Kazachstan;3;
18139;POL;nebraska;"welke Am.staat heeft bijnaam ""Cornhusker state""";3;
18140;POL;netanyahu;huidige (=13e) premier Israel 2012;2;
18141;POL;nevada;"welke Am.staat heeft bijnaam ""The silver state""";3;
18142;POL;new-hampshire;"welke Am.staat heeft bijnaam ""Granite state""";3;
18143;POL;new-jersey;"welke Am.staat heeft bijnaam ""Garden state""";3;
18144;POL;new-mexico;"welke Am.staat heeft bijnaam ""Land of enchantment""";3;
18145;POL;new-york;"welke Am.staat heeft bijnaam ""Empire state""";3;
18146;POL;nieuwe wegen;wat is de naam vd nieuwe pol.partij v.ex PVDA'er Jacques Monasch ;2;
18147;POL;nijmegen;in welke stad had wethouder Depla sex in fietsenkelder stadhuis;2;
18148;POL;nijmegen;waarvan was Ien Dales burgemeester voor ministerschap BZ;2;
18149;POL;nijpels,ed;"welke politicus had bijnaam ""edje kadetje""";3;
18150;POL;nixon;"welke Am. president had bijnaam ""tricky dick""";2;
18151;POL;noordbrabant;van welke provincie is vd Donk sinds 2009 CvdK;2;
18152;POL;noordholland;van welke provincie was v.Kemenade CvdK van 1992-2002;2;
18153;POL;noord-holland;van welke provincie is Arthur v. Dijk CvdK sinds 2019;2;
18154;POL;noord-holland;van welke provincie was Borghouts commissaris koningin 2002-2009;2;
18155;POL;noorwegen;door welk land wordt de Nobelprijs voor de Vrede toegekend/uitgereikt;2;
18156;POL;noorwegen;storting is het parlement van ..;3;
18157;POL;noorwegen;van welk land werd in 1981 Brundtland 1e vrouwelijke premier;2;
18158;POL;north-carolina;"welke Am.staat heeft bijnaam ""Old north state""";3;
18159;POL;north-carolina;"welke Am.staat heeft bijnaam ""Tar Heel state""";3;
18160;POL;north-dakota;"welke Am.staat heeft bijnaam ""Peace Garden state""";3;
18161;POL;north-dakota;"welke Am.staat heeft bijnaam ""Roughrider state""";3;
18162;POL;nvu;van welke pol. partij was Glimmerveen van 1974-1981 en 1983-1987 voorzitter/partijleider;2;
18163;POL;oekraine;van welk land was Joelia Timoschenko van 2007-2010 premier;2;
18164;POL;oekraine;van welk land was Koetsjma van 1994-2004 premier/president;2;
18165;POL;officier van justitie;vertegenwoordiger van het OM bij arrondissementsrechtbank;2;
18166;POL;ogata;voorganger Lubbers als Hoge Comm. Vluchtelingen;3;
18167;POL;ohio;"welke Am.staat heeft bijnaam ""Buckeye state""";3;
18168;POL;oklahoma;"welke Am.staat heeft bijnaam ""Sooner state""";3;
18169;POL;oligarchie;staatsvorm,waarbij macht in handen is van een kleine groep;2;
18170;POL;ollongren;kabinet Rutte-3: minister van Binnenlandse Zaken;1;
18171;POL;ombudsman;welke nationale functie vervult Alex Brenninkmeijer;2;
18172;POL;omtzigt;CDA-coryfee die moest stoppen als woordvoerder MH-17 weg. opvoeren dubieuze getuige;2;
18173;POL;oostenrijk;van welk land is Heinz Fischer president;2;
18174;POL;oostenrijk;van welk land is Werner Faymann bondskanselier;2;
18175;POL;oostenrijk;van welk land was Kreisky in de jaren 70 politiek leider;2;
18176;POL;oostenrijk;van welk land was Kurt Waldheim tot 1992 president;2;
18177;POL;oosterparkwijk;Gron.wijk die eind 1997 werd geteisterd door rellen;2;
18178;POL;opstelten;opvolger mw. Vos-v.Gortel als burgemeester Utrecht;3;
18179;POL;opstelten;voorganger van mw. Brouwer-Korf als burgemeester v. Utrecht;2;
18180;POL;oranjefonds;Nat.huwelijksgeschenk voor Willem-A. en Maxima;2;
18181;POL;oregon;"welke Am.staat heeft bijnaam ""Beaver state""";3;
18182;POL;otto;voornaam van Bismarck, de 1e Bondskanselier;2;
18183;POL;oud;oud-burgem.v.Rotterdam,initiatiefnemer/oprichter VVD;3;
18184;POL;oudenaller,v.;2e kamerlid dat okt.2006 in kamer min.Hoogervorst niet herkende, bijnaam het rode gevaar;2;
18185;POL;oude-pekela;waar werd 2002 standbeeld opgericht voor Fre Meis (geb.pl.);3;
