number;category;answer;question;m;ignore
13001;ECO;hanze;waarvan waren Kampen,Zwolle,Deventer lid van 1200-1600;2;
13002;ECO;hanzelijn;naam toek.treinverbinding tussen Lelystad en Zwolle;2;
13003;ECO;harrods;grootste warenhuis van Europa (Londen);1;
13004;ECO;havana;bij welke stad vinden wij Jose Marti Internat.Airport;3;
13005;ECO;hedges;wie hoort bij Benson;2;
13006;ECO;hefner;oprichter van Playboy;3;
13007;ECO;heineken;aan wie heeft C.de Carvalho, rijkste vrouw Ned.,h.vermogen te danken;2;
13008;ECO;heineken;in-of aanvullen:heerlijk helder ..;1;
13009;ECO;heineken;"over welk merk gaat de reclameslogan ""serving the planet""";2;
13010;ECO;heineken;"over welk merk ging de reclameslogan ""biertje ?!""";1;
13011;ECO;heineken;van welk concern is Jean-Francois van Boxmeer bestuursvoorzitter;3;
13012;ECO;heineken;wie is de vader van Charlene de Carvalho ;2;
13013;ECO;heinsbroek;welke latere minister werd rijk door het opkopen van platenmij Arkade;2;
13014;ECO;heinz;tot welk Am.concern behoort Honig;3;
13015;ECO;heinz;tot welk Am.concern behoren de merken Brinta en Honig;3;
13016;ECO;heinz;tot welk Am.concern behoren de merken Karvan, Roosvicee en ook Kwatta;3;
13017;ECO;henkel;fabrikant van Persil;3;
13018;ECO;hertog jan;"welke bierbrouwer brouwt  ""elfde gebod en janneke""";3;
13019;ECO;hertog jan;welke bierbrouwerij is gevestigd in Arcen;2;
13020;ECO;hiswa;jaarlijkse watersportbeurs in RAI;2;
13021;ECO;hollandia-kloos;van welk bedrijf zijn de gebr.Lubbers eigenaar;3;
13022;ECO;hommen;opvolger Tilmant als bestuursvoorzitter ING;2;
13023;ECO;hond,de;stichter/oprichter v.Newconomy,vm.marktonderzoeker;2;
13024;ECO;honda;"over welk automerk gaat slogan ""the power of dreams""";3;
13025;ECO;honda;welk automerk:accord en civic;1;
13026;ECO;honda;welk automerk:jazz en stream;2;
13027;ECO;hongarije;uit welk land komt vliegtuigmaatschappij Malev;3;
13028;ECO;hongarije;van welk land is de forint de munteenheid;1;
13029;ECO;honorarium;hoe wordt het loon v. uitoefenaars van vrije beroepen (artsen/advocaten etc.) genoemd;2;
13030;ECO;hoogervorst;voorganger Gerritse als bestuursvoorzitter AFM;2;
13031;ECO;hoogovens;welk oernederlands bedrijf zit in Corus, nu Tata;1;
13032;ECO;hoover;"welk merk had de reclameslogan ""want hij klopt en hij veegt en hij zuigt"" ";3;
13033;ECO;houten,v.;opvolger v. Kleisterlee als topman van Philips;3;
13034;ECO;hunter douglas;oorspr.fabrikant v. Luxaflex,eigenlijk een merknaam;3;
13035;ECO;hunter douglas;van welk beursgenoteerd concern is fam. Sonnenberg (Ralph) eigenaar/grootaandeelhouder;3;
13036;ECO;hunter douglas;welk beursgenoteerd concern is eigenaar van Luxaflex;3;
13037;ECO;huub;2 broers v.Doorne zijn de oprichters van DAF, Wim en ..;3;
13038;ECO;hyundai;welk automerk:excel,lantra,pony;2;
13039;ECO;ijlst;Nooitgedacht, schaatsenmaker uit ...;3;
13040;ECO;ijmuiden;waar wordt jaarlijks de buitenversie van de HISWA gehouden;2;
13041;ECO;ijsvogel;welke vogel sierde het allerlaatste biljet v.10 gulden en is symbool Postcodeloterij;2;
13042;ECO;india;van welk land is de Sensex de belangrijkste index vd aandelenbeurs;3;
13043;ECO;interpay;oorspr.naam BGC, waarin werd naam veranderd na fusie met Beanet en Eurocard;3;
13044;ECO;istanbul;tussen welke 2 plaatsen rijdt Taurusexpress: Bagdad en ;3;
13045;ECO;itochu;door welk Japans concern werd Kwik-Fit begin 2011 overgenomen;3;
13046;ECO;jaguar;"over welk automerk gaat slogan ""born to perform""";3;
13047;ECO;jaknikkers;apparaten, waarmee in Schoonebeek olie uit de grond werd gehaald;1;
13048;ECO;janaillac;topman Air France die mei 2018 aftrad nadat personeel zn salarisbod had geweigerd en bleef staken;3;
13049;ECO;janet yellen;voorzitter vd Fed (Am.centrale bank) 2014-2018 incl. voornaam;3;
13050;ECO;jellinek;Mercedes genoemd naar vrouw. Achternaam Oost.Hong.consul in Nice;3;
13051;ECO;jena;Du.stad: centrum optische industrie, gesticht door Carl Zeiss;3;
13052;ECO;jerry;wie hoort bij Ben, als het over ijs gaat;2;
13053;ECO;jobs,steve;mede-oprichter en van 1997-2011 CEO van Apple, overleden 2012;2;
13054;ECO;joekos;van welk Russ.olieconcern was Chodorkowski de topman;3;
13055;ECO;johannesburg;bij welke stad vinden wij Lanseria Internat.Airport;3;
13056;ECO;jongerius,agnes;opvolger Lodewijk de Waal als voorzitter van FNV;2;
13057;ECO;jordanie;in welk land vinden wij Queen Alia International Airport;3;
13058;ECO;joure;waar begon Douwe Egberts in 1753 kruidenierswinkel;3;
13059;ECO;joustra;"opvolger van Vollenhoven als voorzitter van de ""onderzoeksraad voor veiligheid""";3;
13060;ECO;jumbo;door wel bedrijf zijn de La Place-vestigingen buiten de V&D-warenhuizen overgenomen;1;
13061;ECO;jumbo;door welk concern werd Super de Boer in 2009 overgenomen;2;
13062;ECO;jumbo;van welk supermarktconcern is de Brab.familie v.Eerd oprichter en eigenaar;3;
13063;ECO;jupiler;"biermerk met reclameslogan ""mannen/supporters weten waarom""";3;
13064;ECO;jurgens,anton;wie was de grondlegger vd 1e margarinefabriek ter wereld;3;
13065;ECO;kabouter;in-of aanvullen:drink louter ..;1;
13066;ECO;kalkar;in welke plaats in Duitsland staat kernreactor die omgebouwd is tot pretpark;2;
13067;ECO;kamprad,ingvar;oprichter Ikea;3;
13068;ECO;kanaries;welke dieren werden vroeger d.mijnwerkers gebr.om te kijken of er giftige stoffen in de mijn voorkwamen;3;
13069;ECO;kasparus;bierbrouwerij in Nagele;3;
13070;ECO;katwijk;waar vinden wij het viswerkend bedrijf van Ouwehand;3;
13071;ECO;kerviel,jerome;wie verloor bij de Fr.bank Societe Generale 5 miljard euro met speculaties ;2;
13072;ECO;kesteren,v.;voorzitter en algemeen directeur VNO-NCW 2014-2016;3;
13073;ECO;keynes;Br.econoom op wiens ideeen huidige economie is gestoeld;2;
13074;ECO;kia;welk automerk: carnival,magentis,opirus;3;
13075;ECO;kia;welk automerk: rio,shuma,carens;3;
13076;ECO;kia;welk automerk: Sorento,Optima en Rio;2;
13077;ECO;kia;welk automerk: sorento,pregio;3;
13078;ECO;kijfhoek;naam grootste rangeerterrein NS in Ned.;3;
13079;ECO;kip;wat is de munteenheid van Laos;3;
13080;ECO;kip;wat is het meest veelzijdige stukje vlees;1;
13081;ECO;kitkat;invullen-/aanvullen: have a break,have a ...;2;
13082;ECO;kleisterlee,gerard;opvolger Boonstra als topman Philips;3;
13083;ECO;klene;fabrikant koetjesreep, die in 1998 zei produktie te zullen stoppen;3;
13084;ECO;klingenberg&koster;firma die als eerste micro(afval)containers verkocht;3;
13085;ECO;koers;gangbare term voor de prijs van een aandeel;1;
13086;ECO;kolchoz;collectieve boerderij in het voormalige Rusland;2;
13087;ECO;kolk,henk vd;voorzitter FNV-Bondgenoten, die tegen pensioenaccoord stemde;2;
13088;ECO;koppel;wie/wat hoort bij Orenstein;2;
13089;ECO;kpn;door wie werd Getronics in 2007 overgenomen;2;
13090;ECO;kpn;PTT Ned.werd 1998 opgesplitst in post - en telefoontak. Onder welke naam ging telefoontak toen verder (zonder voorvoegsel Kon);1;
13091;ECO;kpn;waarvan is Du.telecom-aanbieder E-plus dochter;2;
13092;ECO;kpn;"wie hanteert de slogan ""waar je ook bent,het is altijd dichtbij""";2;
13093;ECO;kranenborg;wie was chef-kok bij A'dams restaurant Vossius, failliet sep.2003;3;
13094;ECO;kro;"wie gebruikt de slogan ""het gevoel dat je wilt delen"" ";3;
13095;ECO;krombacher;"welk Du. biermerk (pils) heeft slogan ""eine Perle der Natur""";3;
13096;ECO;krona;munteenheid van IJsland;3;
13097;ECO;kuna;munteenheid Kroatie;3;
13098;ECO;landal;waar kun je Bollo de Beer tegenkomen;3;
13099;ECO;lanschot,v.;bank voor vermogende particulieren met hoofdkantoor in d.Bosch;2;
13100;ECO;lanschot,v.;bij welke bank moet u gaan beleggen volgens Evi;2;
13101;ECO;lanschot,v.;van welke bank is Kempen en Co thans een onderdeel;3;
13102;ECO;las vegas;bij welke stad vinden wij McCarran Internat.Airport;3;
13103;ECO;lat;munteenheid Letland tot 2014;2;
13104;ECO;laurus;tot welk concern behoorde Super de Boer;2;
13105;ECO;letland;van welk land is de lat de munteenheid;2;
13106;ECO;lev;wat is de munteenheid van Bulgarije;3;
13107;ECO;lexus;"over welk automerk gaat slogan ""the pursuit of perfection""";3;
13108;ECO;libanon;in welk land vinden wij Internat.luchthaven  Rafik Hariri;3;
13109;ECO;libie;in welk land vinden wij  Luchthaven Mitiga International;3;
13110;ECO;libie;Tamoil is een oliemaatschappij, waarvan de aandelen in de jaren 80 zijn gekocht door welke staat;3;
13111;ECO;lijnbaan;wat was de 1e autoloze straat (uitsl.voetgangers) in Nederland;3;
13112;ECO;lindeboom;welke brouwerij in Limb. Neer brouwt de gouverneurbieren;3;
13113;ECO;loiseau,bernard;Fr.kok die begin 2003 zelfmoord pleegde vanwege verlies ster;3;
13114;ECO;lot;Poolse luchtvaartmij;3;
13115;ECO;luiks;invullen-/aanvullen: hoe het ook zij,..hoort er bij;3;
13116;ECO;maallust;welke bierbrouwerij is gevestigd in het Drentse Veenhuizen;3;
13117;ECO;maastricht;waar staan de inmiddels gesloten brouwerijen van de Ridder;2;
13118;ECO;macdonalds;"welk bedrijf maakt(e) reclame met ""ze zei meneer tegen me""";1;
13119;ECO;macintosh;tot welk concern behoren Scapino,Halfords,Belcompany;3;
13120;ECO;macy's;grootste warenhuis ter wereld (New-York);3;
13121;ECO;madoff;Am.beleggingsfraudeur die piramidespel opzette en 2009 door zijn zoons werd aangegeven ;3;
13122;ECO;magenta;bij drukinkten (toners in printers) komen 4 kleuren voor: key=zwart, yellow=geel,wat is de knalroze kleur;3;
13123;ECO;maggi;invullen-/aanvullen: een beetje van jezelf en een beetje van ..;2;
13124;ECO;majoreren;beursterm:inschrijven op meer aandelen dan gewenst vw.percnt.toewijzing;3;
13125;ECO;maleisie;van welk  land is de ringit de munteenheid;2;
13126;ECO;manilla;bij welke stad vinden wij Rino Aquino Internat.Airport;2;
13127;ECO;markka;munteenheid van Finland voor de komst van de euro;2;
13128;ECO;markt;waar was uw gulden een daalder waard;1;
13129;ECO;marktplaats.nl;"waarover gaat reclameslogan  ""gemaakt voor elkaar""";3;
13130;ECO;martinair;"welk bedrijf maakt(e) reclame met ""your wings""";3;
13131;ECO;mazda;welk automerk: premacy, tribute, MPV;2;
13132;ECO;messerschmidt;1e straaljager;3;
13133;ECO;meurs;financieel directeur die begin 2003 bij Ahold moest opstappen;3;
13134;ECO;mexico;in welk land vinden wij Internat.luchthaven Benito Juarez;3;
13135;ECO;mexico;in welk land vinden wij Internat.luchthaven Generaal Mariano Escobedo;3;
13136;ECO;michelin;van welke firma is Bibendum het symbool/logo;3;
13137;ECO;midkap;onder welke naam is de AMX-index beter bekend;2;
13138;ECO;miele;"welk merk had de reclameslogan ""er is geen betere""";1;
13139;ECO;mitsubishi;Jap. eigenaar van Nedcar in Born;2;
13140;ECO;mittal;door welk Indiaas concern werd Arcelor overgenomen;3;
13141;ECO;mkb-nederland;waarvan was Loek Hermans voorzitter van 2003-2011;2;
13142;ECO;mmm;wat smelt in je mond,niet in je hand;2;
13143;ECO;moberg;opvolger van Cees vd Hoeven als topman Ahold;2;
13144;ECO;molenaar;welke 2 broers waren tot 1992 eigenaar v.Wastora (wasmachines,stofzuigers,radios);3;
13145;ECO;mona;de zuivelste verwenners;2;
13146;ECO;mongolie;in welk land vinden wij  Luchthaven Djengis Khan;3;
13147;ECO;moody's;2 belangrijkste kredietbeoordelaars/ratingbureaus: Standard&Poor's en .. nr.3 = Fitch;3;
13148;ECO;morris,philip;wie is de fabrikant van Marlboro;2;
13149;ECO;moskou;bij welke stad vinden wij Internationale luchthaven Vnoekovo;3;
13150;ECO;most,henny vd;Ov.ondernemer die oa kerncentrale Kalkar en vm aardappelmeelfabr.Oranje omtoverde tot pretpark;3;
13151;ECO;motorola;2 belangrijkste Am.chipproducenten:Intel en ..;2;
13152;ECO;muller,frans;bestuursvoorzitter van Ahold (2018-);3;
13153;ECO;munten;wat:condor,balboa,napoleon;3;
13154;ECO;munten;wat:kip,botje,mijt;3;
13155;ECO;munten;wat:mina,anna,pietje,zeeuw;3;
13156;ECO;munten;wat:paardeoog,kromstaart,snaphaan;3;
13157;ECO;munten;wat:rijder,sikkel,plakker;3;
13158;ECO;munten;wat:rozenobel,piaster,bracteaat;3;
13159;ECO;munten;wat:sjoof,spie,sol;3;
13160;ECO;munten;wat:stoter,pistool,schelling;3;
13161;ECO;munten;wat:voorwiel,karrewiel,imperiaal;3;
13162;ECO;murdoch;eigenaar Br.tabloidkrant News of the World die 2011 weg.afluisterschandalen werd opgeheven;2;
13163;ECO;murdock;welke mediatycoon is eigenaar van The Times,The Sun,BskyB;3;
13164;ECO;musk;topman Tesla auto's;3;
13165;ECO;nachtkijkers;"wat leverde ""Oude Delft"" aan Irak tijdens Golfoorlog";3;
13166;ECO;nairobi;bij welke stad vinden wij luchthaven Jano Kenyatta International;3;
13167;ECO;narita;naast Haneda 2e int.luchthaven van Japan,gelegen in oostelijk deel Tokio ;3;
13168;ECO;nationale nederlanden;door welk concern werd verzekeraar Deltalloyd 2017 overgenomen;2;
13169;ECO;nationale nederlanden;verzekeringspoot ING, die 2015 naar de beurs ging;2;
13170;ECO;nba;beroepsorganisatie vd registeraccountants in Nederland;2;
13171;ECO;ncrv;"wie gebruikt de slogan ""durf te geloven"" ";2;
13172;ECO;nedcar;naam Ned.autofabriek in Limburgse Born, thans onderdeel van VDL;3;
13173;ECO;nelle,v.;welke fabr.in R' dam Delfshaven is kenmerk. voor het Nieuwe Bouwen;3;
13174;ECO;nespresso;waarvoor maakt George Clooney reclame;2;
13175;ECO;nesquick;"welk merk had de reclameslogan ""o jee we zijn de melk vergeten""";3;
13176;ECO;nestle;tot welke multinational behoort ijsfirma Haagen-Dazs;3;
13177;ECO;net-5;"wie gebruikt de slogan ""TV die uitblinkt"" ";3;
13178;ECO;new york times;"welke Am. krant heeft bijnaam ""the old gray lady"" ";2;
13179;ECO;newconomy;bedrijf,opgericht door Maurice de Hond,techno-aand.;2;
13180;ECO;nicaragua;van welk (Middenamerikaans) land is de cordoba de munteenheid;3;
13181;ECO;nieuwenhuizen,joep vd;2004:havendir.Rotterdam moest opstappen wegens garanties aan wie;3;
13182;ECO;nieuwkoop,henk;"reclameslogan wie zal je nooit belazeren""";3;
13183;ECO;nigeria;in welk land vinden wij Murtala Mohammed International Airport;3;
13184;ECO;nmb;"reclameslogan ""wie denkt met je mee""";3;
13185;ECO;noord-korea;in welk land vinden wij Sunan International Airport;3;
13186;ECO;noteboom,ben;voorzitter van de RvB van Randstad;3;
13187;ECO;nouwen;voorganger van Guido v.Woerkom als directeur vd ANWB;3;
13188;ECO;novartis;naam farmac.bedrijf, dat ontstond d.fusie Ciba-Geigy+Sandoz 1996;3;
13189;ECO;ns;"welk bedrijf maakt(e) reclame met de slogan ""laat je gaan""";2;
13190;ECO;numico;welk Ned.bedrijf/concern werd 2007 door Danone overgenomen;2;
13191;ECO;nuon;"welk bedrijf maakt(e) reclame met ""de mogelijkheden zijn eindeloos""";3;
13192;ECO;nutsbedrijven;bedrijven die werken voor algemeen belang itt commerciele bedrijven;2;
13193;ECO;nv;bij Eng./Am.bedrijven Inc.,wat in Ned.;1;
13194;ECO;o2;welke naam had telecombedrijf Telfort tussen 2001 en 2003, daarvoor en daana Telfort;3;
13195;ECO;oad;welke reisorganisatie komt uit Holten;2;
13196;ECO;oldsmobile;welk automerk: alero, silhouette, bravada;3;
13197;ECO;olvarit;onder welke naam verkoopt Nutricia potjes babyvoeding;2;
13198;ECO;oranjeboom;welke bierbrouwerij brouwt Skol;3;
13199;ECO;orenstein;wie/wat hoort bij Koppel;3;
13200;ECO;orientexpres;hoe wordt de trein(dienst) genoemd tussen Londen/Parijs en Istanbul;2;
13201;ECO;osaka;bij welke stad vinden wij Internationale luchthaven Kansai;3;
13202;ECO;oss;waar werd de 1e margarinefabriek ter wereld geopend;3;
13203;ECO;oude delft;welk Ned.bedrijf leverde Irak nachtkijkers (naam op dat moment);3;
13204;ECO;paars;kleur vd krokodil,die begrip is geworden voor bureacratie en overdreven regelzucht;2;
13205;ECO;pamper;onder welke oorspr.merknaam is de wegwerpluier v.Procter en Gamble bek.;2;
13206;ECO;panama;van welk land is de balboa de munteenheid;3;
13207;ECO;panda;welk dier is het symbool van het WNF;2;
13208;ECO;paraguay;uit welk land komt mate, ook wel jezuietenthee, genoemd;3;
13209;ECO;passiva;wat staan aan de creditzijde van de balans van een bedrijf (boekhoudkundige term);2;
13210;ECO;pdf;welke bestanden (3-letterige afk.) kunnen met Adobe-Reader worden gelezen;2;
13211;ECO;pearle;Brilmij werd opgericht in 1959, maar ging 1979 verder onder andere naam, nl……….;2;
13212;ECO;peciney;welk Fr.aluminiumconcern heeft vestiging in Vlissingen;3;
13213;ECO;pengel;vliegveld Zanderij is thans genoemd naar Sur.politicus;3;
13214;ECO;pertamina;Indon.staatsbedrijf belast met winning aardolie en gas;2;
13215;ECO;peru;in welk land vinden wij Internat.luchthaven Jorge Chavez;3;
13216;ECO;peseta;munteenheid Spanje voor de komst van de euro;1;
13217;ECO;peugeot;waarin voel je je lekkerder;1;
13218;ECO;philips;bij welk bedrijf vond in 1990 de operatie Centurion plaats;2;
13219;ECO;philips;van welk concern was Gerard Kleisterlee tot 2011 bestuursvoorzitter;1;
13220;ECO;philips;"welk merk had de reclameslogan ""let's make things better""";1;
13221;ECO;piekema,harry;wie (ex-clown) speelt hoofdrol als filiaalmanager in reclamespotjes AH van 2004-2014;3;
13222;ECO;plus;"wie gebruikt de slogan ""voor jongeren boven de 50"" ";2;
13223;ECO;polen;uit welk land komt luchtvaartmaatschappij Lot;2;
13224;ECO;pon;wie is de importeur van VW en Audi;2;
13225;ECO;portugal;van welk land was de escudo de munteenheid voor de euro;2;
13226;ECO;powell;voorzitter vd Fed (Am.centrale bank) 2018-;2;
13227;ECO;procter and gamble;welk bedrijf produceert Pampers;2;
13228;ECO;procter and gamble;welk concern voert de merken Ariel, Dreft en Head and Shoulders ;3;
13229;ECO;prorail;railinfrabeheerder,maw beheerder vh spoorwegnet in Ned.;1;
13230;ECO;prorail;welk bedrijf gebruikt de Inktpot als hoofdkantoor;3;
13231;ECO;psa;tot welk concern behoort Opel;2;
13232;ECO;pura;Shell's milieuvriendelijke variant van Euro 95;2;
13233;ECO;quantas;nationale luchtvaartmij van Australie;2;
13234;ECO;quote;welk Ned.blad stelt jaarlijks lijst rijkste Ned.op;2;
13235;ECO;radboud;off. naam universiteit Nijmegen/naar wie is universiteit Nijmegen gen.;2;
13236;ECO;radio-2;"wie gebruikt de slogan ""je hoort nog eens wat "" ";2;
13237;ECO;raider;onder welke naam werd lekkernij twix werd tot 1991 in Ned.verkocht ;3;
13238;ECO;randstad;door welk concern werd Tempo Team 1984 overgenomen;3;
13239;ECO;randstad;van welk bedrijf is Goldschmeding oprichter/eigenaar;3;
13240;ECO;randstad;van welk concern is Ben Noteboom CEO/voorzitter RvB;3;
13241;ECO;rappen;waarin is Zwitserse franc verdeeld (100 centimes of ...);2;
13242;ECO;raven;aap, die de Am.tegenhanger vd beursgorilla Jacko genoemd kan worden;3;
13243;ECO;rbs;ABNAMRO werd overgenomen door consortium van 3 banken: Fortis,Banco Santander en …;2;
13244;ECO;real;munteenheid Brazilie;2;
13245;ECO;reed;met welke Eng. uitgever fuseerde Elsevier in 1993;2;
13246;ECO;remuneratie;hoe wordt de beloning/totale beloningspakket genoemd die worden toegekend door RvC aan bestuur onderneming;3;
13247;ECO;renault;"welk bedrijf is de ""createur d'automobiles""";1;
13248;ECO;ret;exploitant trams,bussen,metro in Rotterdam;2;
13249;ECO;rheingold;hoe wordt de trein(dienst) genoemd tussen Hoek v.Holland en Bazel;3;
13250;ECO;ridder,de;welke Maastr.brouwerij brouwde de befaamde Wiekse witte;2;
13251;ECO;rijn-schelde;met wie fuseerde begin 1970 Verolmes Scheepswerven;3;
13252;ECO;rio de janeiro;bij welke stad vinden wij Internationale luchthaven Antonio Carlos Jobim;3;
13253;ECO;rishton,john;opvolger v.Moberg als CEO Ahold (2007);3;
13254;ECO;rivella;"welk merk maakte reclame met ""beetje vreemd,maar wel lekker"" ";3;
13255;ECO;rochdale;van welke woningbouwvereniging was in opspraak geraakte Hubert Mollenkamp directeur, reed in Maserati;3;
13256;ECO;roemenie;in welk land vinden wij Henri Coanda International Airport;3;
13257;ECO;roemenie;van welk land is de lei de munteenheid;2;
13258;ECO;ros,martin;"wie maakt reclame voor Interpolis met sleutelwoord ""glashelder""";3;
13259;ECO;rotterdam;in welke plaats is bierbrouwerij de Pelgrim (oa Mastodont en Zonnelief) gevestigd;3;
13260;ECO;rotterdam;in welke plaats staat de voormalige Van Nelle-fabriek;2;
13261;ECO;rotterdam;welke stad had primeur van 1e autoloze winkelstraat in Ned.;3;
13262;ECO;royal dutch shell;van welk concern (3 woorden) is Ben v.Beurden de topman (CEO/bestuursvoorzitter);2;
13263;ECO;royal dutch shell;van welk concern (3 woorden) was Zwitser Peter Voser de topman (CEO/bestuursvoorzitter);2;
13264;ECO;rtl-4;"wie gebruikt de slogan ""je raakt niet uitgekeken"" ";3;
13265;ECO;rupee;munteenheid India;2;
13266;ECO;sabena;Belg.luchtvaartmij, die in 2001 failliet ging;1;
13267;ECO;sabmiller;welk bedrijf bracht 2007 een bod uit op bierbrouwer Grolsch;3;
13268;ECO;samsung;Kor.bedrijf dat Fokker wilde overnemen,zonder succes;3;
13269;ECO;samsung;"welk bedrijf maakt(e) reclame met ""everyone is invited""";3;
13270;ECO;sandd;concurrent van TNT voor bezorging post > 50 g.;2;
13271;ECO;sandeman;in-of aanvullen:het geheim dat je deelt met ..;3;
13272;ECO;sanskriet;ispat, thans onderdeel v. ArcelorMittal was een vd grootste staalprod.ter wereld. Ispat=staal, maar in welke taal;3;
13273;ECO;santander;welke Sp.banco zat in consortium dat ABN AMRO 2007 overnam;2;
13274;ECO;sap;van welk bedrijf is Dietmar Hopp, sponsor v.Hoffenheim,een vd grondleggers;3;
13275;ECO;scheringa;wie was de eigenaar van DSB-bank;2;
13276;ECO;schilling;munteenheid Oostenrijk voor de komst van de euro;1;
13277;ECO;schinnen;in welke plaats wordt Alfa-edelpils gebrouwen ;3;
13278;ECO;scholten;Rott.dir.havenbedrijf die 2004 moest opstappen weg.garanties a.Joep;3;
13279;ECO;schuttevaer;belangenvereniging van de binnenschippers;3;
13280;ECO;semtex;kneedbaar explosief materiaal,oorspr.gem.door Tsj.bedrijf,gebr.door terroristen;2;
13281;ECO;sensex;belangrijkste index vd aandelenbeurs in Bombay India (zonder BSE);3;
13282;ECO;seoul;bij welke stad vinden wij Gimpo Internat.Airport;3;
13283;ECO;seoul;bij welke stad vinden wij Incheon Internat.Airport;3;
13284;ECO;seoul;op welke effectenbeurs is Kospi belangrijkste index, vgl.AEX = Amsterdam;3;
13285;ECO;ser;waarvan was Wiebe Draijer van 2012-2014 voorzitter;2;
13286;ECO;ser;waarvan werd Rinnooij Kan 2005 voorzitter als opvolger Wijffels;2;
13287;ECO;sevilla;bij welke Sp. stad vinden wij luchthaven San Pablo;3;
13288;ECO;shag;wat:drum,twin,samson;1;
13289;ECO;sheffield;welke Eng.stad is centrum staalindustrie en bekend door messen;3;
13290;ECO;shv;van welk concern is familie Fentener v.Vlissingen eigenaar;3;
13291;ECO;sibneft;van welk bedrijf is Abramovitsj,eig.Chelsea,grootaandeelhouder;3;
13292;ECO;siemens;van welk concern was Osram (lampen e.d.) een dochter, sinds 2013 zelfstandig;2;
13293;ECO;siena;in welke It.stad is de oudste bank t.wereld/Monte Paschi,opg.1472,gevestigd;3;
13294;ECO;sigaretten;wat:bastos,winfield,dunhill;2;
13295;ECO;singapore;van welke beurs is Straits Times de graadmeter-index;2;
13296;ECO;singapore airlines;welke luchtvaartmij heeft de 1e Airbus-380 geleverd gekregen;2;
13297;ECO;six flags;Flevohof werd Walibi Flevo en daarna pretpark onder welke naam;2;
13298;ECO;skoda;"automerk met slogan""altijd leuk om anderen jaloers te maken""";3;
13299;ECO;skoda;welk automerk komt uit Pilsen;2;
13300;ECO;skoda;welk automerk: octavia, fabia;2;
13301;ECO;skol;"biermerk dat Ned.trachtte te veroveren met slogan ""hoppiger pils""";2;
13302;ECO;skyscraper;hoe wordt een rechtopstaande langwerpige advertentie genoemd maar ook Am. wolkenkrabber;3;
13303;ECO;sligro;topman van het jaar 2006 was Abel Slippens.Van welk bedrijf;3;
13304;ECO;slovenie;uit welk land komt vliegtuigmaatschappij Adria Airways;3;
13305;ECO;slovenie;van welk land was de tolar de munteenheid, per 1-1-2007 over op euro;2;
13306;ECO;smart;"over welk automerk gaat slogan ""open your mind""";3;
13307;ECO;smit,jeroen;"schrijver ""de prooi"" over ondergang ABNAMRO";2;
13308;ECO;smith,adam;"wie schreef ""an inquiry into the nature & causes of the wealth of nations""";3;
13309;ECO;smits;opvolger Scholten als directeur Havenbedrijf Rotterdam;3;
13310;ECO;sneek;waar is de fabrikant van King gevestigd;3;
13311;ECO;sns;van welke bank is ASN, de bank voor maatschappelijk verantwoord ondernemen,een dochter;2;
13312;ECO;sns;"welk bedrijf maakt(e) reclame met ""zo kan het ook""";1;
13313;ECO;sns;"welk bedrijf maakte reclame met ""groot geworden door klein te blijven""";2;
13314;ECO;sns;welk financieel concern werd begin 2013 door Ned.staat genationaliseerd;1;
13315;ECO;sns;wie is de eigenaar/grootaandeelhouders van Routemobiel;3;
13316;ECO;societe generale;bij welke Fr.bank fraudeerde Jerome Kerviel (2008) voor ca. 5 milj.euro;2;
13317;ECO;sommelier;hoe wordt de kelner genoemd, belast met toezicht op kelder/wijnen;2;
13318;ECO;sonnenberg;wie is eigenaar/grootaandeelhouder van Hunter Douglas, bekend v. Luxaflex;3;
13319;ECO;sony;welk (Jap.) concern vond uit/introduceerde de walkman (1979);2;
13320;ECO;spanje;uit welk land is oliemaatschappij Repsol afkomstig;3;
13321;ECO;spar;"welk bedrijf maakt(e) reclame met ""elke dag een vers idee""";2;
13322;ECO;sparta;fiets- en electrische fietsfabrikant (nr.1 in Ned.)  uit Apeldoorn;1;
13323;ECO;specsavers;"welk bedrijf maakt(e) reclame met ""bij Europas beste betaal je minder""";3;
13324;ECO;spyker;door welk (Ned.) bedrijf werd autofabrikant Saab in 2011 overgenomen;1;
13325;ECO;sri lanka;in welk land vinden wij Bandaranaike International Airport;3;
13326;ECO;ssangyong;welk automerk:rexton,kyron,rodius;3;
13327;ECO;staal,boele;voorzitter vh bestuur van de Nederlandse Vereniging van Banken (NVB) 2007-2013;3;
13328;ECO;stampersgat;in welke plaats staat de suikerfabriek Dinteloord vd Suikerunie;3;
13329;ECO;standard&poor's;2 belangrijkste kredietbeoordelaars/ratingbureaus: Moody's en .. nr.3 = Fitch;3;
13330;ECO;stelios;welke Griekse zakenman is de oprichter van Easyjet;3;
13331;ECO;stint;electrische bakfiets, vooral in gebruik bij kinderopvang, verboden op openbare weg na ongeluk Oss;1;
13332;ECO;stokkum,sjoerd v.;opvolger v.Jort Kelder als hoofdredacteur Quote;3;
13333;ECO;stork;van welk concern is ex-NS-dochter Werkspoor onderdeel;2;
13334;ECO;straddle;combinatie van een koop- en verkoopoptie;3;
13335;ECO;strauss-kahn;directeur IMF van 2007-2011, voornaam Dominique;2;
13336;ECO;strauss-kahn;voorganger van Christine Lagarde als hoofd/directeur IMF;2;
13337;ECO;stuttgart;uit welke Du.stad komen Mercedes-Benz,Porsche,ook geb.stad v.Hegel ;2;
13338;ECO;suissair;wat is de luchtvaartmaatschappij van Zwitserland;2;
